{"user_role": "Finance_Intern", "permissions": {"department": ["Finance", "Interns"], "access_level": "Intern", "allowed_actions": ["View Financial Reports", "Generate Financial Summaries", "Data Entry", "Basic Financial Analysis"], "vendor_restriction": ["ApprovedVendorA", "ApprovedVendorB"], "password_rotation": 90, "automation_restriction": true, "region_restriction": ["NorthAmerica", "Europe"], "device_compliance": true}, "query": "Request access to view all financial reports generated by ApprovedVendorA and ApprovedVendorB in the Finance department, located in NorthAmerica and Europe regions, with a focus on Data Entry and Basic Financial Analysis, using devices compliant with the organization's security policies, and requiring password rotation every 90 days, with automated access restricted for this request.", "expected_response": "full", "rationale": "This query satisfies all permission constraints:\n\n- Department: The query targets the Finance department, which is within the user's allowed departments.\n- Access level: The user is requesting access as an Intern, which matches their access level.\n- Allowed actions: The query includes actions like Data Entry and Basic Financial Analysis, which are within the user's allowed actions.\n- Vendor restriction: The query specifically mentions ApprovedVendorA and ApprovedVendorB, which are within the user's allowed vendors.\n- Password rotation: The query requires password rotation every 90 days, which matches the user's password rotation policy.\n- Automation restriction: The query explicitly states that automated access is restricted for this request, aligning with the user's automation restriction.\n- Region restriction: The query targets NorthAmerica and Europe regions, which are within the user's allowed regions.\n- Device compliance: The query ensures that devices used for this access are compliant with the organization's security policies, matching the user's device compliance requirement.", "source_index": 10476, "generation_strategy": "all_active", "synthetic": true}
{"user_role": "HR_Manager", "permissions": {"department": ["Human Resources", "Employee Relations", "Talent Acquisition", "Compensation and Benefits", "Employee Development"], "access_level": "Manager", "allowed_actions": ["Employee Data Management", "Policy Enforcement", "Compliance Auditing", "Benefits Administration", "Performance Reviews"], "quorum_required": 3, "incident_required": false, "session_timeout": 30, "competitor_restriction": false, "training_required": ["Data Privacy Training", "Information Security Awareness", "HR Compliance Training", "Anti-Harassment Training", "Diversity and Inclusion Training"]}, "query": "Grant full access to the HR team for 30 minutes to manage employee data, enforce HR policies, conduct compliance audits, administer benefits, and conduct performance reviews for employees in the Human Resources, Employee Relations, Talent Acquisition, Compensation and Benefits, and Employee Development departments. The access should not be restricted to any competitors and does not require incident reporting. The quorum requirement is met with at least 3 team members. The request is made after completing all required training sessions.", "expected_response": "full", "rationale": "The query satisfies all permission constraints as follows:\n- Department: The query targets all specified departments (Human Resources, Employee Relations, Talent Acquisition, Compensation and Benefits, and Employee Development).\n- Access Level: The query is made by an HR_Manager with the required access level of Manager.\n- Allowed Actions: The query includes all specified allowed actions (Employee Data Management, Policy Enforcement, Compliance Auditing, Benefits Administration, and Performance Reviews).\n- Quorum Required: The query is made with at least 3 team members, meeting the quorum requirement.\n- Incident Required: The query does not require incident reporting, as specified in the permission constraints.\n- Session Timeout: The query is valid for 30 minutes, meeting the session timeout requirement.\n- Competitor Restriction: The query does not restrict access to any competitors, as specified in the permission constraints.\n- Training Required: The query assumes that the requester has completed all required training sessions (Data Privacy Training, Information Security Awareness, HR Compliance Training, Anti-Harassment Training, and Diversity and Inclusion Training).", "source_index": 4506, "generation_strategy": "all_active", "synthetic": true}
{"user_role": "Junior_Software_Engineer", "permissions": {"department": ["Software Development"], "access_level": "Limited", "allowed_actions": ["Report bugs", "Read code repositories", "Submit code reviews", "Write unit tests"], "session_timeout": 30, "training_required": ["Code security best practices", "Basic information security awareness"], "zone_restriction": ["Development environment", "QA environment"], "device_compliance": true, "mask_sensitive": true}, "query": "As a Junior Software Engineer in the Software Development department, I need to request FULL access to read and write code repositories in the Development environment for the 'my_project' project, and also submit code reviews for the 'my_feature' feature branch. I have completed the required training on Code security best practices and Basic information security awareness. I am using a compliant device and will ensure that sensitive information is masked. I also request a 30-minute session timeout for this access.", "expected_response": "full", "rationale": "This query satisfies all permission constraints as follows:\n\n- Department: The user is a Junior Software Engineer in the Software Development department, which matches the required department permission.\n- Access level: Although the access level is Limited, the query is requesting FULL access, which should override the limited access level.\n- Allowed actions: The query includes the allowed actions 'Read code repositories' and 'Submit code reviews', which are part of the user's permissions.\n- Session timeout: The user requests a 30-minute session timeout, which matches the required session timeout.\n- Training required: The user has completed the required training on Code security best practices and Basic information security awareness.\n- Zone restriction: The query includes the Development environment, which is part of the allowed zones.\n- Device compliance: The user is using a compliant device, which matches the required device compliance.\n- Mask sensitive: The user will ensure that sensitive information is masked, which matches the required mask sensitive information.\n\nTherefore, all permission constraints are satisfied, and the expected response is 'full'.", "source_index": 2286, "generation_strategy": "subset", "synthetic": true}
{"user_role": "Senior_Manager_Sales", "permissions": {"department": ["Sales", "Marketing"], "access_level": "Senior Manager", "allowed_actions": ["edit_sales_reports", "access_customer_data", "view_sales_data", "generate_sales_forecasts"], "environment_restriction": ["Development", "Testing"], "retention_period": "2 years", "incident_required": true, "vendor_restriction": ["Salesforce", "HubSpot"], "phishing_detection": true}, "query": "Request for full access to edit sales reports in the Sales department, using Salesforce as the vendor, for the next 2 years, across Development and Testing environments, with incident reporting required, and phishing detection enabled. This includes access to customer data for marketing purposes, as well as viewing sales data for forecasting purposes.", "expected_response": "full", "rationale": "The query satisfies all permission constraints as follows: \n\n- Department: The query specifically mentions the Sales department, which is included in the user's role permissions. Marketing is also included, which is acceptable since the role has access to Marketing as well.\n- Access Level: The query is requested by a Senior Manager, which matches the user's role access level.\n- Allowed Actions: The query includes all allowed actions, such as edit_sales_reports, access_customer_data, view_sales_data, and generate_sales_forecasts.\n- Environment Restriction: The query specifies access across Development and Testing environments, which are both included in the user's role permissions.\n- Retention Period: The query requests access for the next 2 years, which matches the retention period specified in the user's role permissions.\n- Incident Required: The query requires incident reporting, which matches the user's role permissions.\n- Vendor Restriction: The query uses Salesforce as the vendor, which is one of the restricted vendors included in the user's role permissions. HubSpot is also acceptable since it's another restricted vendor.\n- Phishing Detection: The query enables phishing detection, which matches the user's role permissions.\n", "source_index": 8279, "generation_strategy": "subset", "synthetic": true}
{"user_role": "VP_Sales", "permissions": {"department": ["Marketing", "Sales", "Customer Support"], "access_level": "VP", "allowed_actions": ["view", "share", "edit"], "device_compliance": true, "rate_limit": 1000, "log_required": true, "collaboration_access": ["Human Resources", "IT", "Finance"], "session_timeout": 30}, "query": "View, share, and edit confidential quarterly sales reports from the Sales department, collaborating with Human Resources to identify market trends and allocate resources. Ensure all logins originate from compliant devices with a session timeout of 30 minutes and a rate limit of 1000 queries per hour.", "expected_response": "full", "rationale": "This query satisfies all permission constraints:\n\n- Department: The query involves the Sales department, which is within the user's allowed departments (Marketing, Sales, and Customer Support).\n- Access level: The query requires VP-level access, which aligns with the user's access level (VP_Sales).\n- Allowed actions: The query involves viewing, sharing, and editing reports, which are all within the user's allowed actions (view, share, and edit).\n- Device compliance: The query requires all logins to originate from compliant devices, aligning with the user's device_compliance requirement (true).\n- Rate limit: The query does not exceed the user's rate limit of 1000 queries per hour.\n- Log required: The query requires logging, which aligns with the user's log_required requirement (true).\n- Collaboration access: The query involves collaboration with Human Resources, which is within the user's allowed collaboration departments (Human Resources, IT, and Finance).\n- Session timeout: The query requires a session timeout of 30 minutes, aligning with the user's session_timeout requirement (30 minutes).\n", "source_index": 2615, "generation_strategy": "subset", "synthetic": true}
